{
  "actor": "shiki-cli",
  "evidence": [
    ".shiki/goals/G-20260622T105712032406Z-4d8486bb.json",
    ".shiki/plans/P-20260622T105712031287Z-8e102c49.json"
  ],
  "goal_id": "G-20260622T105712032406Z-4d8486bb",
  "id": "L-20260622T105712032756Z-37099549",
  "links": [],
  "summary": "Goal registered from plan: \u516c\u5f0f\u4e00\u6b21\u60c5\u5831\u306e\u307f\u304b\u3089\u6bce\u671dAI\u30cb\u30e5\u30fc\u30b9\u3092\u7cbe\u67fb\u3057\u3001\u4e8b\u5b9f\u3068\u5177\u4f53\u7684\u5f71\u97ff\u3092\u5206\u96e2\u3057\u3066LINE\u3078\u81ea\u52d5\u901a\u77e5\u3059\u308b",
  "task_id": null,
  "timestamp": "2026-06-22T10:57:12+00:00",
  "type": "goal-created"
}
