{
  "actor": "shiki-cli",
  "evidence": [
    ".shiki/locks/T-20260622T105712033421Z-a277a190.json"
  ],
  "goal_id": "G-20260622T105712032406Z-4d8486bb",
  "id": "L-20260622T105712034699Z-3f234b49",
  "links": [],
  "summary": "Locks acquired for T-20260622T105712033421Z-a277a190",
  "task_id": "T-20260622T105712033421Z-a277a190",
  "timestamp": "2026-06-22T10:57:12+00:00",
  "type": "lock"
}
