{
  "actor": "shiki-cli",
  "evidence": [
    ".shiki/starts/START-20260622T105712939215Z-ab5ef776.json",
    ".shiki/plans/P-20260622T105712031287Z-8e102c49.json"
  ],
  "goal_id": "G-20260622T105712032406Z-4d8486bb",
  "id": "L-20260622T105713326415Z-f5e9eb3e",
  "links": [
    "https://github.com/mizutani-140/ai-daily-brief/issues/1"
  ],
  "summary": "Shiki start START-20260622T105712939215Z-ab5ef776 initialized mizutani-140/ai-daily-brief",
  "task_id": null,
  "timestamp": "2026-06-22T10:57:13+00:00",
  "type": "handoff"
}
